{
  "@context": "https://mif-spec.dev/schema/container-context.jsonld",
  "@type": "MemoryCorpus",
  "containerProfileVersion": "0.1.0",
  "records": [
    {
      "kind": "document",
      "payload": {
        "@type": "DocumentReference",
        "id": "urn:mif:doc:ncp-requirements-pdf",
        "documentType": "pdf",
        "title": "ncp-requirements.pdf"
      }
    },
    {
      "kind": "memory",
      "payload": {
        "@context": "https://mif-spec.dev/schema/context.jsonld",
        "@type": "Memory",
        "@id": "urn:mif:11111111-1111-4111-8111-111111111111",
        "conceptType": "semantic",
        "namespace": "_semantic/requirements",
        "content": "GB300 NVL72 compute nodes MUST meet NVQual and NVCert.",
        "created": "2026-06-25T00:00:00Z"
      }
    },
    {
      "kind": "memory",
      "payload": {
        "@context": "https://mif-spec.dev/schema/context.jsonld",
        "@type": "Memory",
        "@id": "urn:mif:22222222-2222-4222-8222-222222222222",
        "conceptType": "semantic",
        "namespace": "_semantic/requirements",
        "content": "Intra-NVL72 NCCL all-reduce baseline on GB200 is 900 GB/s+.",
        "created": "2026-06-25T00:00:00Z"
      }
    }
  ],
  "provenance": { "@type": "prov:Entity", "wasDerivedFrom": "ncp-requirements.pdf" }
}
