{
  "@context": "https://mif-spec.dev/schema/container-context.jsonld",
  "@type": "MemoryCorpus",
  "containerProfileVersion": "0.1.0",
  "records": [
    {
      "kind": "document",
      "payload": {
        "@type": "DocumentReference",
        "url": "https://internal.example.com/docs/ncp-requirements.pdf",
        "documentType": "pdf",
        "contentType": "application/pdf",
        "byteLength": 128374,
        "hash": {
          "algorithm": "sha256",
          "value": "9f86d081884c7d659a2feaa0c55ad015a3bf4f1b2b0b822cd15d6c15b0f00a08"
        },
        "retrievedAt": "2026-06-25T00:00:00Z",
        "title": "NCP GB300 NVL72 Platform Requirements"
      }
    },
    {
      "kind": "memory",
      "payload": {
        "@context": "https://mif-spec.dev/schema/context.jsonld",
        "@type": "Memory",
        "@id": "urn:mif:11111111-1111-4111-8111-111111111111",
        "conceptType": "semantic",
        "namespace": "_semantic/requirements/facts",
        "content": "GB300 NVL72 compute nodes MUST meet NVQual and NVCert.",
        "created": "2026-06-25T00:00:00Z",
        "documents": [
          {
            "@type": "DocumentReference",
            "url": "https://internal.example.com/docs/ncp-requirements.pdf"
          }
        ]
      }
    },
    {
      "kind": "memory",
      "payload": {
        "@context": "https://mif-spec.dev/schema/context.jsonld",
        "@type": "Memory",
        "@id": "urn:mif:22222222-2222-4222-8222-222222222222",
        "conceptType": "episodic",
        "namespace": "_episodic/events/benchmarks",
        "content": "Intra-NVL72 NCCL all-reduce baseline on GB200 measured 900 GB/s+ during the 2026-06-25 qualification run.",
        "created": "2026-06-25T00:00:00Z"
      }
    }
  ],
  "provenance": {
    "@type": "prov:Entity",
    "wasDerivedFrom": {
      "@id": "urn:mif:bundle:ncp-requirements-2026-06"
    }
  },
  "editChain": [],
  "extensions": {
    "mnemos:compressionManifest": [
      {
        "id": "cmp_001",
        "memory_id": "urn:mif:11111111-1111-4111-8111-111111111111",
        "engine": "apollo",
        "compression_ratio": 0.42,
        "judge_decision": "compressed_wins"
      }
    ]
  }
}
